{
  "schema_version": "1.0",
  "event_id": "55555555-5555-4555-8555-555555555555",
  "device_id": "22222222-2222-4222-8222-222222222222",
  "session_id": "33333333-3333-4333-8333-333333333333",
  "agent_id": "66666666-6666-4666-8666-666666666666",
  "parent_agent_id": "44444444-4444-4444-8444-444444444444",
  "provider": "claude",
  "source": "inferred",
  "event_type": "agent.started",
  "activity": "delegating",
  "confidence": "inferred",
  "occurred_at": "2026-10-23T09:00:01+09:00",
  "sequence": 43
}
