{
  "schema_version": "1.0",
  "event_id": "11111111-1111-4111-8111-111111111111",
  "device_id": "22222222-2222-4222-8222-222222222222",
  "session_id": "33333333-3333-4333-8333-333333333333",
  "agent_id": "44444444-4444-4444-8444-444444444444",
  "parent_agent_id": null,
  "provider": "codex",
  "source": "hook",
  "event_type": "tool.started",
  "activity": "coding",
  "confidence": "observed",
  "occurred_at": "2026-10-23T00:00:00Z",
  "sequence": 42
}
