{
  "schema_version": "1.0",
  "event_id": "9a1f0c3e-6b2d-4e7a-8c5f-1d2e3f4a5b6c",
  "device_id": "22222222-2222-4222-8222-222222222222",
  "session_id": "33333333-3333-4333-8333-333333333333",
  "agent_id": "44444444-4444-4444-8444-444444444444",
  "parent_agent_id": null,
  "provider": "codex",
  "source": "hook",
  "event_type": "plan.updated",
  "activity": "planning",
  "confidence": "observed",
  "occurred_at": "2026-10-23T00:00:00Z",
  "sequence": 42,
  "plan_steps": [
    "completed",
    "in_progress",
    "pending"
  ]
}
